,Unnamed: 0,Unnamed: 0.1,category,date,source,text,title,month,country-source,article_len,ratio_not_stop_w,avg_word_len,title_len,ratio_unique_words,ner,sen
224,224,558,Region,2018-11-30,Vostok-RU,Podgorički Viši sud uvažio je žalbe Specijalnog državnog tužilaštva (SDT) i odredio zatvor poslanicima opozicionog Demokratskog fronta (DF) Milanu Kneževiću i Nebojši Medojeviću zbog odbijanja da svedoče u predmetima SDT-a saopšteno je danas iz tog suda.Na sajtu suda objavljeno je da su Knežević i Medojević odbili da svedoče i pošto su bili novčano kažnjeni rešenjima vanraspravnog krivičnog veća Višeg suda prenosi RTCG.Medojević je uhapšen sinoć nakon sednice Skupštine Crne Gore i nalazi se u Zavodu za izvršenje krivičnih sankcija a Knežević se nalazi u parlamentu. „Zatvor traje dok svedoci M. K. i N. M. ne pristanu da svedoče ili dok njihovo saslušanje postane nepotrebno ili dok se krivični postupak ne završi a najduže do dva meseca računajući od dana lišavanja slobode“ navodi se u saopštenju Višeg suda. ,Zatvor i za Milana Kneževića,11,RU,127,0.1811023622047244,6.433070866141733,5,0.7637795275590551,"['fronta', 'k', 'gore', 'tužilaštva', 'knežević', 'skupštine', 'milanu', 'medojeviću', '.', 'crne', 'kneževića', 'demokratskog', 'kneževiću', 'm', 'milana', 'podgorički', 'rtcg.medojević']",-0.03
225,225,2985,Politika,2018-12-05 07:13:00,Sputnik-RU,"Brod sa kontejnerom punim najnovijeg naoružanja za potrebe opremanja takozvane kosovske vojske trenutno je na putu preko Atlantika do luke Drač u Alabaniji odakle će opasni tovar biti odvezen do baza kosovskih bezbednosnih snaga pišu Večernje novosti pozivajući se na podatke do kojih su došle srpske bezbednosne službe.Kako objašnjava list „ovaj konspirativni aranžman je u sklopu sumornog scenarija Prištine o preuzimanju kontrole nad severnim delom pokrajine“. <p align=""LEFT"" class=""marker-quote1"">„Ova paklena igra koju iza zavese vodi Amerika uklapa se u planove prištinske vlasti koja namerava da 14. decembra kršeći sve sporazume osnuje vojsku Kosova“ navodi list. <p align=""LEFT"">„Oni su preko Tačija i njegovog ministra Endrija Šalje u kosovskoj vladi predložili uvođenje taksa kako bi isprovocirali Haradinaja da preduzme još radikalnije mere“ rekao je neimenovani izvor za beogradski list. <p align=""LEFT"" class=""marker-quote1"">„Zbog toga Priština traži da Kfor pojača prisustvo na severu i da hermetički zatvori ’granicu‘ prema centralnoj Srbiji navodno u cilju sprečavanja šverca robe“ rekao je neimenovani izvor. <p align=""LEFT"">Pored toga ističe list traži i da Kfor u slučaju da Beograd kao kontrameru prekine vodosnadbevanje iz Gazivoda u njegovo ime preuzme kontrolu nad tim strateški važnim jezerom.",Brod pun oružja: CIA Albancima šalje oružje radi preuzimanja severa,12,RU,186,0.14516129032258066,7.091397849462366,10,0.8064516129032258,"['cia', 'prištine', 'endrija', 'drač', 'alabaniji', 'vladi', 'kosova', 'amerika', 'beograd', 'kosovskoj', 'srbiji', 'kfor', 'gazivoda', 'priština', 'tačija']",0.004830917874396135
226,226,9199,,2018-11-21 18:05:00,RFE-USA,"Visoka predstavnica Evropske unije za spoljnu politiku i bezbednost Federika Mogerini pozvala je kosovsku vladu da odmah ukine odluku o povećanju carine na proizvode iz Srbije i Bosne i Hercegovine. “Današnja odluka Vlade Kosova da poveća porez na robu iz Srbije i Bosne i Hercegovine na 100 odsto jeste jasno kršenje sporazuma CEFTA i duha Sporazuma o stabilizaciji i pridruživanju između Evropske unije i Kosova. To dodatno pogoršava situaciju nakon početnog povećanja poreza od 10 odsto prošle sedmice. Vlada Kosova mora odmah da ukine ove odluke” navela je Mogerini u pisanom saopštenju. Vučić: Vlada Srbije obratiće se članicama EU i SB UN  Predsednik Srbije Aleksandar Vučić izjavio je u sredu uveče da će se Vlada Srbije 22. novembra obratiti članicama Saveta bezbednosti Ujedinjenih nacija i Evropske unije koje će upoznati sa kako je rekao ""činjenicama o kršenju Sporazuma o stabilizaciji i pridruživanju i CEFTA sporazuma"" od strane Prištine. On je nakon sednice Saveta za nacionalnu bezbednost rekao i da su svi državni organi dobili zadatke posle odluke Prištine da poveća takse na uvoz robe iz centralne Srbije sa 10 na 100 odsto. Takođe je najavio da će u četvrtak u njegovom prisustvu u Beogradu u 13 sati biti održan sastanak sa predstavnicima Srba sa Kosova. On je dodao da među Srbima na Kosovu postoji izvesna uznemirenost i da su hteli da izađu na demonstracije. Ističe da oni sa taksom od 100 odsto neće moći da kupuju robu na koju su navikli da dobijaju lekove kojima se leče. Predsednik Srbije poručio je kosovskim Albancima da je mir najpotrebniji. Pre sednice Saveta bezbednosti sastao se sa ambasadorima Rusije Kine EU i zemalja Kvinte. No media source currently available  Vučić je na tom sastanku izrazio očekivanje da će zemlje Kvinte i Evropska komisija ukazati Prištini na ""neprihvatljivost jednostranih poteza"" kojim rizikuju eskalaciju sukoba i dovode u opasnost mir i stabilnost u regionu. Na sastanku sa ambasadorima zemalja Kvinte (SAD Velike Britanije Francuske Italije i Nemačke) i šefom Delegacije Evropske unije upozorio je i na moguće posledice ""neodgovornog poteza"" Prištine o povećanju taksi na 100 odsto na robu iz Srbije. Ambasadori su izrazili zabrinutost zbog moguće destabilizacije kao i za budućnost dijaloga apelujući na Vučića i Vladu Srbije da racionalno i mirno pristupe rešavanju najnovije krize navodi se u saopštenju Predsedništva Srbije. Ambasadori Rusije i Kine Aleksandar Čepurin i Li Mančang su izrazili punu podršku naporima Srbije da krizu reši mirnim putem uz poštovanje međunarodnog javnog prava i postignutih sporazuma i ugovora u regionu saopštilo je Predsedništvo Srbije. Vučić je rekao da mere Prištine vode ka punoj destabilizaciji celog regiona i da mogu dovesti i do dublje eskalacije sukoba. Vučić i ambasadori Rusije i Kine su se dogovorili da budu u svakodnevnom kontaktu dok ""kriza koju je Priština izazvala ne bude prevaziđena"". Šef delegacije Evropske unije u Srbiji Sem Fabrici izjavio je u Novom Sadu da je tokom dana bio na sastanku sa predsednikom Srbije te da je tada kazao da je stav EU o potezu Prištine i uvođenju taksi na robu iz Srbije i BiH da je to stoprocentno kršenje Sporazuma o slobodnoj trgovini u EU (CEFTA). ""Naš je stav prilično jasan uvođenje mera je sto odsto kršenje CEFTA sporazuma i protivi se duhu Sporazuma o stabilizaciji i pridruživanju. Tražili smo od kosovskih vlasti da povuku odluku odmah"" rekao je Fabrici u Novom Sadu. Prema njegovim rečima dijalog između Prištine i Beograda u kojem kao facilitator učestvuje i EU moglo bi biti najefikasnije mesto na kojem bi se ovakvi problemi mogli raspraviti. ""Dijalog uz posredovanje EU je najbolje mesto da se razgovara o mnogim stvarima da se nadje zajednički dogovor i očekujem nastavak dijaloga"" rekao je Fabrici. Premijerka Srbije Ana Brnabić izjavila je u sredu uveče u Novom Sadu da je povećanje takse na uvoz robe iz Srbije ""besmislena i nerazumna mera"" Prištine ali da se nada da neće biti kontramera. ""Kada razgovaramo o CEFTA sporazumu mi govorimo i o međusobnom priznavanju profesionalnih i akademskih kvalifikacija i protoku ljudi a ne samo roba i usluga u regionu. Sve sa ciljem da napravimo zajednički ekonomski prostor. Ovakve odluke nas vraćaju u 19. vek"" rekla je Brnabić. Dodala je da ona ne bi volela da Srbija u ovom trenutku razmišlja o bilo kakvim recipročnim merama. ""Mi želimo da održimo saradnju i da se nastavi dijalog sa Prištinom o normalizaciji odnosa. Mislim da ćemo pre svega razgovarati sa našim međunarodnim partnerima o tome da li zaista možemo da računamo na njihovu podršku"" kazala je Brnabić. Dodala je da izjave visokih predstavnika EU govore da će ""situacija biti rešena"". ""Ovo nije samo nepoštovanje međunarodnih sporazuma koji se tiču slobodne trgovine već i ogroman udarac za sve Srbe koji žive na Kosovu i Metohiji na njihov životni standard. Ovo je besmislena mera i ja molim još jednom i Prištinu i sve naše partnere da što pre reaguju i da se ovo povuče pa da se vratimo razgovorima"" kazala je ona. Haradinaj: Dijalog sa Srbijom nezaobilazan ali nužna i zaštita interesa Kosova Vlada Kosova uvela je 21. novembra nove carine od 100 odsto na proizvode iz Srbije i Bosne i Hercegovine u cilju kako se navodi jačanja domaće proizvodnje ekonomije i kosovske državnosti. Odluka je usledila nakon predloga ministra trgovine Endrita Šalje. On je istovremeno pozvao domaće proizvođače da se fokusiraju na kvalitet a od trgovaca zatražio da istražuju nova tržišta za saradnju. Na Facebooku je podsetio da se kosovski proizvođači suočavaju sa mnogim barijerama u Srbiji i da se njihovi proizvodi ne plasiraju na srpskom tržištu. ""Od danas mera od 100 odsto Srbiji"" napisao je premijer Ramuš Haradinaj na Fejsbuku.""Takođe Vlada obavezuje Ministarstvo trgovine i industrije i sve relevantne institucije da uklone i zaustave potencijalni uvoz svih proizvoda koji se ne odnose i u suprotnosti su sa zvaničnim i ustavnim imenom Republike Kosova"" istakao je Haradinaj i dodao da odluka stupa na snagu odmah. Haradinaj je naglasio da to ni ovog puta ne važi za međunarodne brendove koji se proizvode u Srbiji. Na konferenciji za novinare nakon sednice Vlade Haradinaj je rekao da Srbija u mnogim slučajevima nije poštovala pravila CEFTA-e te da se i pored upozorenja Kosova takvo ponašanje Srbije nije promenilo.""Ukoliko odete do Kuksa i Tropoje (na severu Albanije) nema srpske robe ali ima dovoljno druge robe i živi se. Ako je ta roba došla do tamo nije teško da uđe i na Kosovo"" kazao je kosovski premijer. ""I velikim trgovcima ali i nama interes je građanin Kosova koji je i potrošač. Ove mere imaju za cilj zaštitu interesa građana i nadamo se da nas i trgovci razumeju"" kazao je Haradinaj.""Dvadeset godina je od rata 10 godina od nezavisnosti i vidi se da Srbija ne razume drugačije osim kada mora da se dogovori sa tobom. Verujem i da i EU i Amerika znaju da Srbija ne razume drugačiji pristup"" dodao je kosovski premijer.""Srbiji je sada palo na pamet da postoji CEFTA a šta se dešavalo svih ovih godina?"" upitao je Haradinaj. On je dodao da je dijalog sa Srbijom nezaobilazan ali da je nužna i zaštita interesa Kosova. Zamenik premijera Kosova Enver Hodžaj napisao je na Tviteru da se ovakvom odlukom štite vitalni interesi Kosova.""Srbija nastavlja agresivnu kampanju protiv Kosova na međunarodnom planu. Ona takođe minira i proces normalizacije. Kako bi zaštitila naš interes Vlada Kosova je odlučila da poveća carinu na 100 odsto. Nove mere će biti uskoro objavljene"" napisao je Hodžaj. Vlada Kosova je prethodno uvela carinu od 10 posto na proizvode iz Srbije i BiH u cilju zaštite domaćeg tržišta ali i zbog kako je navela destruktivnog ponašanja Srbije prema Kosovu. Ovakva odluka Vlade Kosova naišla je na velike kritike Evropske unije i ostalih međunarodnih predstavništava uz obrazloženje da Kosovo time krši pravila CEFTA-e. Ljajić: Ovakva mera predstavlja potpunu obustavu trgovine između centralne Srbije i Kosova ""Potez Kosova doveo je do toga da Sporazum o slobodnoj trgovini Zapadnog Balkana više ne postoji"" prva je reakcija Rasima Ljajića ministra trgovine i potpredsednika Vlade Srbije koju je dao Radiju Slobodna Evropa (RSE) na odluku vlasti u Prištini da uvedu carinu od 100 odsto na proizvode iz Srbije i Bosne i Hercegovine.     ""Ovo je par ekselans politička a ne ekonomska ili trgovinska mera ili odluka. Ovakva mera predstavlja potpunu obustavu trgovine između centralne Srbije i Kosova. Jer će naši proizvođači biti potpuno nekonkurentni u odnosu na druge proizvođače iz regiona. I sa druge strane ovo svakako ima veze sa vrlo blagim reakcijama međunarodne zajednice na dosadašnje vancarinske barijere koje je Kosovo uvodilo. Pre svega uvođenje dodatne takse na proizvode iz Srbije i Bosne i Hercegovine"" rekao je Ljajić.   Rasim Ljajić i ministar vanjske trgovine i ekonomskih odnosa BiH Mirko Šarović u ponedeljak (19. novembra) su odlučili da ne učestvuju na ministarskoj konferenciji Centralnoevropskog sporazuma o slobodnoj trgovini (CEFTA) početkom decembra u Prištini – zbog odluke prištinskih vlasti da uvedu taksu od 10 odsto na robu iz BiH i Srbije. Šarović i Ljajić su uputili zajedničko pismo nekolicini evropskih zvaničnika poput Federike Mogerini visoke predstavnice EU Sesiliji Malstrom komesarki EU za trgovinu nemačkom ministru ekonomskih odnosa Peteru Altmajeru i trgovinskom savetniku u kabinetu predsednika SAD Robertu Lajtnigeru u kome su zahtevali da se od Prištine traži da povuče odluku o taksi. BiH: Reakcija na odluku u Interpolu Ministar spoljne trgovine i ekonomskih odnosa BiH Mirko Šarović izjavio je kratko za portal Klix.ba da Kosovo uvođenjem stopostotnih carina Bosni i Hercegovini i Srbiji definitivno ruši CEFTA-u. Šarović će se kako prenosi ovaj portal posle sednice Saveta ministara BiH u četvrtak izjasniti detaljnije u vezi s carinama. Na vest o povećanju taksi za BiH i Srbiju sa 10 na 100 posto reagovali su i iz Vanjskotrgovinske komore BiH. Predsednik komore Nemanja Vasić kaže da je ova odluka kosovske Vlade politička. ""Ovo je reakcija na ono što se dešavalo oko Interpola. Na potezu je Evropska komisija. Kosovo to ne može dugo držati zato što će sebe isključiti iz svih evropskih tokova. Bojim se da će ostati izolovani jer ipak zemlje CEFTA-e su prihvatile da primjenjuju i štite taj sporazum o slobodnoj trgovini jer to je tržište od 30 miliona"" kaže Vasić. On dodaje i kako ne veruje da će Kosovu Srbija i BiH uvoditi kontra mere ali ni da će kosovska Vlada dobiti za taj potez podršku bilo koga bez obzira što neke države koriste taj prazan prostor. Kako je rekao nada se da će u ovoj situaciji ipak prevladati razum.","Kosovo uvelo carine od 100 odsto Srbiji i BiH, Mogerini pozvala na ukidanje odluke",11,USA,1711,0.06662770309760374,6.186440677966102,14,0.4739918176504968,"['mirko', 'srbija', 'sad', 'eu', 'bih', 'hercegovine', 'prištini', 'prištinu', 'srbije', 'evropska', 'kine', 'kosova', 'kazala', 'saveta', 'kosovu', 'metohiji', 'srbima', 'albanije', 'mančang', 'evropske', 'novom', 'balkana', 'prištine', 'kosovskim', 'italije', 'srbiji', 'ujedinjenih', 'četvrtak', 'mogerini', 'šarović', 'predsedništvo', 'bosne', 'beogradu', 'ona', 'sb', 'bosni', 'vlada', 'federika', 'bezbednosti', 'hodžaj', 'saopštilo', 'aleksandar', 'kosovo', 'evropa', 'čepurin', 'ana', 'kazao', 'slobodna', 'vučić', 'ramuš', 'lajtnigeru', 'haradinaj', 'beograda', 'nacija', 'ministara', 'vučića', 'priština', 'rusije', 'nemačke', 'sadu', 'amerika', 'predsedništva', 'republike', 'enver', 'unije', 'francuske', 'ambasadori', 'komisija', 'hercegovini', 'nemanja', 'ljajić', 'srbiju', 'li', 'srbijom', 'brnabić', 'albancima', 'vlade', 'interpola', 'britanije', 'delegacije', 'i', 'državnosti', 'robertu', 'un', 'velike', 'facebooku', 'rasim', 'vasić']",0.014669926650366746
227,227,6823,Vesti,2019-01-29,N1-USA,"[""Vođeni društvenom angažovanošću kao centralnom temom našeg rada pružamo podršku protestima koji se odvijaju u sve većem broju gradova u Srbiji"" kaže se u tekstu podrške zaposlenih u Institutu za filozofiju i društvenu teoriju (IFDT) Univerziteta u Beogradu protestima u gradovima Srbije. Naučnici profesori i saradnici Instituta u saopštenju ukazuju na pogubne tendencije u srpskom društvu koje sve više jačaju: demokratske institucije su u potpunosti ""otete"" i kao takve ne rade u javnom interesu nestručni rad pravosuđa nesvrsishodno pooštravanje kaznene politike Srbija se pretvara u zemlju robovskog rada koja je u vrhu evropskih zemalja po nejednakosti i eksploataciji krše se ustavne ingerencije nosilaca vlasti a partokratija je prisutna na svim nivoima državne uprave. Osim toga ""demonstriranje da zakon ne važi za sve podjednako stalno prokazivanje ’neprijatelja’ i sasvim neskriveno gušenje rasprave stavlja do znanja da je svaki oblik drugačijeg mišljenja kritike i alternativnog delovanja nepoželjan a potencijalno i opasan. Neprestano stvaranje tenzija i insinuiranje mogućih nasilnih konflikata stvara atmosferu straha od drugoga što se obilato eksploatiše za maskiranje ključnih društvenih problema. Ljudi se dele na patriote i izdajnike raspiruje se netrpeljivost između različitih grupa građana i stalno se potencira konflikt sa drugim nacijama"" navodi se u saopštenju. Protesti u gradovima Srbije jasan su znak da dostojanstven život nesvodiv na puko preživljavanje postaje združeni zahtev ljudi koji zajedno hodaju. Kada postane opasno javno govoriti i kada izostaju oni koji naše glasove mogu politički da zastupaju hodanje postaje najrečitiji oblik kritike dodaje se u saopštenju. ""Podržavamo ovaj autentični glas koji se čuje širom Srbije kao svojevrstan proces političkog osvešćivanja"" navodi se na kraju teksta podrške koji je potpisalo 32 zaposlenih u Institutu za filozofiju i društvenu teoriju. Potpisnici su: Milivoj Bešlin naučni saradnikPetar Bojanić naučni savetnik Aleksandra Bulatović naučna saradnicaJelena Ćeriman istraživačica saradnicaMiloš Ćipranić istraživač pripravnikIgor Cvejić naučni saradnikVladimir Cvetković naučni saradnikBalša Delibašić istraživač pripravnikJelena Đurić naučni saradnikAleksandar Fatić naučni savetnikIrena Fiket naučna saradnicaMarjan Ivković naučni saradnikRastko Jovanov naučni saradnikMarko Konjović istraživač pripravnikPredrag Krstić naučni saradnikAleksandra Lazić istraživačica pripravnicaMark Lošonc istraživač saradnikPredrag Milidrag viši naučni saradnikMrđan Mlađan istraživač saradnikOlga Nikolić istraživačica pripravnicaSara Nikolić istraživačica pripravnicaAleksandar Pavlović naučni saradnikSrđan Prodanović naučni saradnikGazela Pudar Draško naučna saradnicaŽeljko Radinković naučni saradnikBojana Radovanović istraživačica saradnicaMichal Sladeček naučni saradnikĐurđa Trajković naučna saradnicaMilan Urošević istraživač pripravnikJelena Vasiljević naučna saradnicaMarija Velinov istraživač pripravnikAdriana Zaharijević naučna saradnica  ]","IFDT: Kad je opasno govoriti, hodanje je najrečitija kritika",1,USA,378,0.08465608465608465,8.005291005291005,9,0.7142857142857143,"['pripravnikadriana', 'istraživačica', 'trajković', 'milivoj', 'pavlović', 'urošević', 'đurić', 'bešlin', 'srbija', 'saradnikmarko', 'milidrag', 'cvejić', 'pudar', 'saradnikpredrag', 'saradnikolga', 'draško', 'pripravnikigor', 'fatić', 'bojanić', 'srbiji', 'saradnikđurđa', 'saradnikaleksandra', 'zaharijević', 'radovanović', 'bulatović', 'srbije', 'pripravnicasara', 'univerziteta', 'mlađan', 'delibašić', 'beogradu', 'lošonc', 'cvetković', 'jovanov', 'krstić', 'u', 'saradnicamiloš', 'saradnikbojana', 'pripravnikjelena', 'ivković', 'lazić', 'aleksandra', 'konjović', 'nikolić', 'pripravnikpredrag', 'prodanović', 'pripravnicaaleksandar', 'ćipranić', 'vasiljević']",-0.008333333333333333
228,228,2746,Politika,2018-11-22 13:35:00,Sputnik-RU,"Predsednik Srbije Aleksandar Vučić sastaje se sa predstavnicima Srba s Kosova i Metohije posle odluke Prištine da poveća takse na srpsku robu na 100 odsto.Pratićemo situaciju a ljudi iz naše službe će me obaveštavati o situaciji na terenu“ rekao je Vučić u Klubu poslanika.„Znamo u koliko se teškom položaju nalazite a mere Prištine govore da ostajete bez vitalnih proizvoda“ kazao je Vučić u razgovoru sa Srbima sa KiM. „Čak su nam zaustavili kiseonik za našu bolnicu u Kosovskoj Mitrovici. <a href=""https://rs-lat.sputniknews.com/videoclub/201811221117917312-kosovo-spaljivanje-proizvoda/"" rel=""nofollow"" target=""_blank"">Organizovanje lomača u Kačaniku</a> je potpuno isto kao paljenje jevrejskih knjiga u nacističkoj Nemačkoj“ istakao je Vučić.Predsednik Srbije kaže da je konačno životni standard ljudi počeo da napreduje i mi to ne možemo da ugrozimo.„Zato ne možemo da dozvolimo da nas uvuku u bilo kakav vid konfrontacije. Ja se nadam da nikome neće pasti na pamet da napada i ubija Srbe. To Srbija neće dozvoliti. Vidim da je i <a href=""https://rs.sputniknews.com/rusija/201811221117919481-moskva-osudila-pristina-objavila-trgovinski-rat-beogradu/"" target=""_blank"">Ministarstvo spoljnih poslova Rusije</a> itekako razumelo šta je to što se dešava na Kosovu i Metohiji. <a href=""https://rs.sputniknews.com/vesti/201811221117918535-haradinaj-takse-ultimatum/"" target=""_blank"">Haradinajeva izjava</a> nas dovodi u užasnu poziciju. Ali on to nije sam smislio to govori da i neke druge sile stoje iza njega. Nije to iz njegove glave izašlo. Moramo da se spremimo za dugu i tešku borbu pošto mu nezavisnost nećemo priznati“ poručio je Vučić.<strong>Nadam se da nikom neće pasti na pamet da ubija ljude</strong>„Imamo robu i ekonomiju koja napreduje. Konačno je životni standard krenuo da napreduje i ide uzlaznom putanjom. To ne smemo da ugrozimo. Moramo da damo sve od sebe da izbegnemo svaku vrstu konfrontacije. Oni će pokušati da nas uvuku u sukobe sa raznoraznim provokacijama. Moramo da budemo jedni uz druge ostanemo zajedno i mirnim dozvoljenim političkim sredstvima se borimo. Nadam se da nikome neće pasti na pamet da primeni silu protiv našeg naroda i krene u ubijanje ljudi samo zato što su Srbi. To srpska država neće dozvoliti“ rekao je predsednik. Predsednik Srpske liste Goran Rakić istako je da je narod na Kosovu i Metohiji uplašen i da od srpskih vlasti i naroda u Srbiji očekuje podršku.„Rekli ste da mir nema alternativu ali kakva je alternativa ako naše bolnice ne budu imale lekove i ako naša deca ne budu imala namirnice“ upitao je Rakić.Rakić je poručio da kosmetski Srbi neće biti nemi posmatrači i da neće dozvoliti da ih proteruju sa njihovih vekovnih ognjišta.Pre sastanka koji je otvoren za javnost održane su konsultacije sa predstavnicima Srba sa KiM.","UŽIVO Vučić: Na delu je najgori nacizam, i kiseonik su nam zaustavili za bolnicu (video)",11,RU,404,0.12623762376237624,6.893564356435642,15,0.6188118811881188,"['aleksandar', 'nacističkoj', 'kosovo', 'kazao', 'srbija', 'prištine', 'vučić', 'moskva', 'kim', 'srba', 'kosovskoj', 'srbiji', 'mitrovici', 'srbije', 'rakić', 'kosova', 'nemačkoj', 'goran', 'pristina', 'kosovu', 'metohije', 'metohiji', 'beogradu', 'rusije', 'liste', 'rs', 'rakić.rakić', 'rusija', '-', '201811221117919481']",-0.0234375
229,229,6790,Vesti,2019-01-29,N1-USA,"[Predsednik Liberalno-demokratske partije (LDP) Čedomir Jovanović izjavio je da je ta stranka opozicija i vlasti i onima koji se predstavljaju kao opozicija i kritikovao lidere Saveza za Srbiju (SzS) zbog toga što kako je rekao LDP nazivaju izdajnicima jer nije bojkotovala posetu slovenačkog predsednika Boruta Pahora Skupštini Srbije. Jovanović je u saopštenju naveo da lideri SzS nazivaju LDP izdajnicima jer se nije priključila jučerašnjem bojkotu ""kao što je Miloševićev režim krajem osamdesetih izdajnicima proglasio one koji ne bojkotuju slovenačku robu"".  28.01.2019. ""Neće biti demokratije u Srbiji ako je vodeća ideologija nacionalizam i izolacija od sveta. To je naša jasna poruka vladajućoj eliti kolegama iz opozicije ali pre svega građanima željnim slobode i normalnog života"" ocenio je Jovanović.  On je kazao da SzS pokušava da imitira populističke antievropske pokrete a da LDP želi više Evrope u Srbiji. ""Nema lepe budućnosti za Srbiju u kojoj se organizuje doček za Putina a bojkotuje Pahor"" kazao je Jovanović i dodao da LDP nije zainteresovan za uvrede onih koji ih nazivaju lažnom opozicijom.  Jovanović je rekao da je promena koju građani zaslužuju Srbija koja nije u sukobu ili nesporazumu sa susedima te da je neophodan dogovor sa Prištinom u vezi sa Kosovom.  ""Tačno je da Vučić danas uglavnom govori ono što je LDP govorio pre pet ili pre deset godina ali se time ne zadovoljavamo jer kao društvo nemamo toliko vremena za čekanje. Na suprotnoj strani je samozvana 'pravoverna' opozicija čiji politički program je temeljno pročišćen od pojmova pomirenje suočavanje sa prošlošću ljudska prava evropske integracije regionalna saradnja tržišna ekonomija"" napisao je Jovanović. On je rekao da je LDP prihvatio poziv organizatora i predstavnika građanskih protesta širom Srbije i upitao kada gde i sa kim treba da razgovara o tome.  ""Nakon opravdanog zahteva da opozicija pokaže na koji način se razlikuje od aktuelne vlasti najglasniji opozicionari su na LDP-u demonstrirali najgore osobine za koje optužuju Vučića – uvrede i diskvalifikacije umesto dijaloga isključivosti i podelu na 'naše' i 'njihove' ambiciju za vlašću koja prevazilazi sve vrednosti i uverenja"" rekao je Jovanović.   ]",Jovanović: LDP je opozicija i vlasti i onima koji se predstavljaju kao opozicija,1,USA,337,0.14540059347181009,6.560830860534126,13,0.6706231454005934,"['slovenačkog', 'skupštini', 'on', 'jovanović', 'srbije', 'demokratske', 'evrope', 'ldp', 'vučić', 'putina', 'čedomir', 'srbiju', 'kosovom', '-', 'vučića', 'liberalno', 'boruta', 'pahora', 'partije', 'srbiji', 'srbija']",-0.023622047244094488
