,Unnamed: 0,Unnamed: 0.1,category,date,source,text,title,month,country-source,article_len,ratio_not_stop_w,avg_word_len,title_len,ratio_unique_words,ner,sen
159,159,2648,Politika,2018-11-17 18:15:00,Sputnik-RU,Od proglašenja nezavisnosti dosad više od 45 hiljada građana Kosova se odreklo državljanstva.Ova se brojka smatra visokom i zabrinjavajućom za kosovsko Ministarstvo unutrašnjih poslova piše „Info.ks.net“.Načelnik Odeljenja za državljanstvo Ministarstva unutrašnjih poslova Liridon Neziri izjavio je za „Kosova pres“ da se od 2009. godine oko pet hiljada osoba svake godine odriče državljanstva Republike Kosova.Ovaj fenomen se događa kaže Neziri jer neke zemlje EU u kojima žive građani Kosova ne dopuštaju dvojno državljanstvo građanima koji nisu državljani Evropske unije.„Više od 45 hiljada osoba odreklo se državljanstva Republike Kosova od 2009. do ovog trenutaka. To se ne odnosi na sve novije trendove ljudi koji žele da žive u zemljama Evropske unije uglavnom se odnosi na emigracije koje smo imali tokom godina s ljudima koji već imaju bazu u zemljama Evropske unije. Tu su integrirani i žele živeti tamo“ podvukao je Neziri.Oko 70 odsto onih građana koji su se odrekli državljanstva Kosova su iz Nemačke. Zvaničnik Ministarstva unutrašnjih poslova je negirao da se uskraćivanje državljanstva događa zbog neliberalizacije viznog režima ili socioekonomskog statusa.„Ovo se ne odnosi na proces liberalizacije viznog režima za slobodno kretanje nego samo na proces države koja nije deo Evropske unije. Kosovo ima ogroman talas iseljavanja u zemlje Evropske unije uglavnom u Nemačku Austriju ili čak u skandinavske zemlje. Što se tiče odricanja od državljanstva Kosova najviše ima zahteva iz Nemačke. Ova brojka je relativno velika jer te zemlje ne dopuštaju dvojno državljanstvo zato građani koji su sada integrisani u tim zemljama Evropske unije odlučuju zadržati državljanstvo tih zemalja“ rekao je Neziri.Prema njegovim rečima samo Francuska i Švajcarska ne obavezuju odricanje od državljanstva.  Inače ukupan broj ljudi sa Kosova u dijaspori procenjuje na oko 700.000 u EU i SAD. ,Više od 45 hiljada građana Kosova se odreklo kosovskog državljanstva,11,RU,279,0.17562724014336914,6.774193548387097,10,0.5985663082437276,"['sad', 'eu', 'nemačke', 'kosovo', 'francuska', 'kosova', 'unije', 'švajcarska', 'evropske', 'neziri', 'republike', 'ministarstva', 'nemačku', 'austriju', 'pres', 'liridon']",-0.005
160,160,7314,Vesti,2019-02-15,N1-USA,"[Predsednik Jedinstvene Srbije (JS) Dragan Marković Palma pozvao je predstavnike opozicije da ne organizuju protestne šetnje na današnji dan jer je danas ne samo državni već i ""crkveni praznik i crveno slovo"". ""Danas je državni praznik crkveni praznik i crveno slovo i ja zato pozivam opoziciju da ako im je nešto sveto u životu da danas onda ne šetaju jer ne znam za koga ili protiv koga bi to radili. Ako su na sednici Saveta bezbednosti UN sve države podržale Srbiju i tražile od kosovskih Albanaca da ukinu takse od 100 odsto onda mi u Srbiji ako smo državotvorni i pravoslavci treba da pokažemo svetu da smo bar jedan dan u godini jedinstveni"" rekao je Marković na proslavi Sretenja stranačke slave JS. Marković je tom prilikom pozvao međunarodnu zajednicu da zbog nepoštovanja Briselskog sporazuma uvede sankcije kosovskim Albancima.  ]",Palma pozvao opoziciju da ne organizuje proteste na crveno slovo,2,USA,139,0.23741007194244604,6.057553956834532,10,0.7194244604316546,"['dragan', 'palma', 'srbije', 'marković', 'un', 'saveta', 'bezbednosti', 'srbiji']",-0.010638297872340424
161,161,6252,Svet,2019-01-21,N1-USA,"[Izraelska vojska saopštila je da je napala iranske ciljeve u Siriji kao odgovor na presretanje rakete ispaljene sa sirijske teritorije. Vojska Izraela je u noći između nedelje i ponedeljka saopštila da izvodi napade na elitne jedinice Al-Kods Čuvara iranske revolucije u Siriji.  Vojska je upozorila na ""svaki pokušaj napada na teritoriju ili vojsku Izraela"".  Detalji o napadima nisu saopšteni.  Izraelska vojska juče je saopštila da je raketa ispaljena iz Sirije presretnuta nad delom Golanske visoravni koji je pod okupacijom Izraela.  ]",Napad izraelske vojske na iranske ciljeve u Siriji,1,USA,81,0.1728395061728395,6.679012345679013,8,0.7654320987654321,"['al', 'siriji', 'sirije', 'presretnuta', 'sirijske', 'izraela', 'iranske', 'elitne']",-0.015151515151515154
162,162,10341,,2019-02-09 21:13:00,RFE-USA,"Gradonačelnik Splita Andro Krstulović Opara oštro je u subotu osudio napad na nekoliko igrača vaterpolo kluba Crvena zvezda u Splitu uz poruku da Split ""nije i neće biti grad koji tolerira nasilje bilo kakve vrste"". ""Osuđujem napad na trojicu vaterpolista Crvene zvezde koji su danas htjeli uživati na splitskoj Rivi. Split je otvoren i gostoljubiv grad. To smo dokazali i činit ćemo sve da tako i ostane"" napisao je gradonačelnik na Facebooku. I splitsko-dalmatinski župan Blaženko Boban ocijenio je povodom napada da svaki stanovnik Splita i Splitsko-dalmatinske županije ne može reći da voli svoj grad županiju ili domovinu ako se na takve situacije ne zgražava. ""Ne mislim da dobro čini bilo tko koji se ne zgražava nad takvim stvarima. Takva osoba ne može reći da voli svoj grad županiju ili domovinu"" rekao je Boban. Bivša premijerka Jadranka Kosor rekla je da je napad na sportiste iz Srbije u Splitu sramotan. Prema navodima hrvatskih medija policija vjeruje da će brzo otkriti huligane budući da na splitskoj Rivi gotovo svaki poslovni prostor ima video nadzor. Izvršni direktor Hrvatskog vaterpolo saveza Perica Bukić takođe je osudio napad uz ocjenu da je svaki čin nasilja neprihvatljiv i da se tako nešto ne smije potcijeniti u vaterpolo zajednici. On je dodao da je do napada došlo na javnom prostoru u gradu daleko od sportskog borilišta i u slobodno vrijeme sportista. Bukić je napomenuo da u Regionalnoj vaterpolo ligi u 11 sezona koliko se odvija ovo takmičenje nikada nije bilo nikakvih incidenata niti napada na sportiste te da se nada da ovaj incident neće uticati na do sada korektne odnose između svih učesnika lige klubova i saveza kao i na sam projekat zajedničkog takmičenja. Napad huligana na Zvezdine vaterpoliste osudio je i Hrvatski olimpijski odbor koji smatra da je krajnje vrijeme da nadležne državne službe i institucije počnu rigorozno provoditi zakonske akte protiv huliganizma u sportu i oko sporta. Iz Hrvatskog olimpijskog odbora navode da ovakvi ispadi bacaju ogromnu mrlju na Hrvatsku kao svjetski prepoznatljivu sportsku i turističku destinaciju. Napad na beogradske vaterpoliste osudio je i Vili Marinić sekretar Vaterpolo kluba Mornar protiv koga je Crvena zvezda trebala odigrati utakmicu u Splitu. Ministar spoljnih poslova Srbije Ivica Dačić rekao je da će Srbija uručiti protest Hrvatskoj zbog ovog napada .",Hrvatska javnost osudila napad na srpske vaterpoliste u Splitu,2,USA,374,0.13101604278074866,6.296791443850268,9,0.6470588235294118,"['bukić', 'zvezda', 'mornar', 'marinić', 'hrvatskog', 'crvene', 'dalmatinski', 'županije', 'ivica', 'vili', 'srbija', 'splitu', 'srpske', 'splitsko', 'boban', 'javnost', 'olimpijski', 'opara', 'hrvatskoj', 'splita', 'blaženko', 'srbije', 'rivi', 'split', 'perica', 'splitsko', 'vaterpolo', 'kluba', 'olimpijskog', 'hrvatski', 'vaterpoliste', 'vaterpolo', 'krstulović', 'jadranka', 'dalmatinske', 'sramotan', 'odbora', 'regionalnoj', 'kosor', 'ocijenio', 'ligi', 'hrvatska', 'gostoljubiv', 'saveza', 'odbor', 'hrvatsku', 'crvena', '-', 'facebooku', 'dačić']",-0.02651515151515152
163,163,2453,Naoružanje,2018-11-07 20:53:00,Sputnik-RU,Specijalni trenažer konstruisan za obučavanje letačkog osoblja u standardnom režimu letenja prilikom snažnog manevrisanja otkazivanja avionske tehnike grešaka u tehnikama pilotiranja i nepovoljnim meteorološkim uslovima isporučen je Federalnoj službi vojske Nacionalne garde Rusije (Rosgvardija) saopštila je pres-služba kompanije CNTU „Dinamika“.„Sistem vizualizacije trenažera predstavlja osmokanalni projekcioni sitem sa sfernim ekranom i računarskom sintezom slika koji svakom članu posade pruža kontinuiranu i celovitu sliku prostora van kabine sa vidnim poljem od najmanje 240° horizontalno i 60° vertikalno. Generisanje slika prostora izvan kabine omogućava vizualizaciju okruženja u različitim fazama letenja helikoptera u svim rasponima visine brzine i raznim vremenskim uslovima“ navodi se u saopštenju. Osim toga ističe se da sistem omogućava simuliranje letova na površini od najmanje 200h200 kvadratnih kilometara kao i da detaljno opisuje prostor reprodukuje slike skoro svih stvarnih objekata kao i specijalnih efekata — disperziju sunčeve svetlosti maglu oblačnost dinamične senke vihore prašine i snega i slično. Trenažer je smešten na teritoriji novog centra za obuku koji zadovoljava sve zahteve savremenih trenažnih sistema za obuku u vazduhoplovstvu.  ,Rosgvardija dobila nove trenažere,11,RU,167,0.10179640718562874,7.622754491017964,4,0.8083832335329342,"['rusije', 'nacionalne', 'garde']",0.0
164,164,8473,Aktuelno,2018-12-14 18:50:28,VOA-USA,"Sedmogodišnja Žaklin Kal Makuin iz Gvatemale koja je iz Meksika u SAD došla sa ocem preminula je pošto je uhapsila američka granična policija. U javnosti se i dalje postavljaju brojna pitanja ko je odgovoran za njenu smrt. Kancelarija Generalnog inspektora Sekretarijata za unutrašnju bezbednost saopštila je da će sprovesti nadzor nad agencijom koja kontroliše Službu za zaštitu granica i carina. Žakliln je sa ocem 29-godišnjim Nerijem Kalom prešla granicu SAD i Meksika 6. decembra. Istog dana su je u grupi od 163 migranata preuzeli granični policajci a prema izveštajima Službe za carine i granice nije bilo naznaka da je zdravlje devojčice ugroženo. Ali sledećeg jutra Žaklin je bila u jako lošem stanju i preminula je posle ponoći 8. decembra u dečjoj bolnici u El Pasu u Teksasu. Uzrok smrti je bio septični šok. Otac je bio sa njom. U izveštaju Sekretarijata za unutrašnju bezbednost navodi se da ""devojčica tokom opasnog višednevnog i dugog puta kroz nepristupačan teren kako tvrdi njen otac nije konzumirala hranu ni vodu povraćala je i upala u septični šok nakon kojeg je hitno prebačena u bolnicu gde je preminula"". Sekretarka za unutrašnju bezbednost Kirsten Nilsen je za ovu tragediju delimično okrivila veličinu grupe imigranata i lokaciju na kojoj su se predali graničnoj patroli – i rekla da je bila “predaleko od mesta na kojem su imigranti mogli da budu procesuirani”.    ",Ko je odgovoran za smrt sedmogodišnje migrantkinje u pritvoru u SAD?,12,USA,224,0.15178571428571427,6.2142857142857135,11,0.6964285714285714,"['sad', 'kal', 'inspektora', 'uhapsila', 'migrantkinje', 'el', 'sedmogodišnja', 'generalnog', 'sekretarijata', 'pasu', 'kirsten', 'nilsen', 'meksika', 'žaklin', 'gvatemale', 'makuin']",-0.024539877300613498
165,165,7905,Vesti,2019-02-24,N1-USA,"[Izvor: N1 Predsednik Srbije Aleksandar Vučić izjavio je danas da je opozicija pozivala ljude na proteste u sezoni gripa a njemu su zamerili što se slikao sa bolesnim dečakom u Institutu za majku i dete. 21.02.2019. Vučić je novinarima u Trsteniku kazao da je sedam dana trpeo napade jer je majka koja brine o svom bolesnom dečaku želela da se dečak slika s njim i zbog toga je bio kriv. ""Oni su kad je bila sezona gripa pozivali ljude na proteste a ja sam kriv zbog jedne slike sa dečakom"" rekao je Vučić. On je za novinara Milojka Pantića i ostale koji govore na građanskim protestima ""Jedan od pet miliona"" u Srbiji rekao da su ""mali ljudi"". ""Što me više ti mali ljudi napadaju ja znam da sam time i veći i značajniji i bolji čovek jer oni to ne mogu da rade onome ko je loš čovek nego samo onome ko je mnogo bolji od njih"" kazao je Vučić. Prema njegovim rečima opozicija vidi da ""postoji jedan kojeg ne mogu da uplaše"". Na pitanje o građanskim protestima Vučić je odgovorio da ""broj onih koji protestuju nije važan"". ""Broj onih koji protestuju nije važan. Imaju ljudi pravo. Važno je da čujete šta misle ljudi i da uzvratite većim radom i odgovornošću. Ne mogu da slušam Pantića Trifunovića Đilasa...imaju pravio da šetaju kad god hoće. Njihov problem samnom je što ja ne brinem"" rekao je Vučić nazvavši ""Pantića TrifunovićaĐilasa i druge malim ljudima"". Komentarišući informaciju da su na sinoć na protestu u Beogradu demonstranti lepili nalepnice na leđa radnika Gradske čistoće Vučić je rekao da se pita ""gde je tim ljudima srce i vaspitanje"". ""Mene brine želja da nekoga ponizite da radnicima lepite nalepnice na leđa gde si to sine naučio i video"" upitao je Vučić. On je dodao da građani imaju pravo da šetaju koliko hoće a da se o protestima ne izveštava jer se ""ljudi u zemlji plaše histerije i napada kao što su doživeli ljudi iz Gradske čistoće sinoć"". ""Da li je bilo 1.400 1.600 i 1.800 ljudi nebitno. Imaju ljudi pravo nekad je bilo 4.000 i 5.000 ali važno je da čujete šta ljudi misle i pokušate da uzvratite što više radom"" rekao je on. Prema njegovim rečima na skupovima u toku kampanje ""Budućnost Srbije"" okupi se više ljudi nego na protestima nezadovoljnih građana. ""Mi smo danas u Velikoj Drenovi imali više ljudi nego u Beogradu sinoć a u Kruševcu će većeras biti tri puta više"" kazao je Vučić. Izvor: Tanjug Vučić je izjavio da ne postoji nikakav sporazum u 17 tačaka o promeni granica sa Kosovom. ""Šta da vam kažem na to što je babi milo to joj se i snilo"" rekao je Vučić novinarima u Trsteniku gde je u okviru kampanje ""Budućnost Srbije"" obišao fabriku ""PPT Petoletka"". Vučić je istakao da ""nema baš ničega"" odnosno da ne postoji nikakav sporazum i nikave mape. ""To mora da su pisali Tači (Hašim) i Haradinaj (Ramuš) nema tu ni jedne tačke a kamoli 17"" rekao je Vučić demantujući pisanje nemačkog dnevnika ""Frankfurter rundšau"" (Frankfurter Rundschau) uz opasku da je ta informacija preuzeta iz prištinskih medija. Kako je nemački dnevnik objavio EU i SAD spremne su da prihvate razmenu teritorija između Srbije i Kosova i u Vašingtonu bi 12. juna trebalo da bude potpisan sporazum o promeni granice koji bi stupio na snagu šest meseci kasnije. ""Nedavno je procureo dokument koji sadrži plan podele Kosova. U 17 tačaka reč je o povlačenju nove granice između Albanaca i Srba na severu Kosova i o pripajanju Kosovu nekoliko pretežno Albancima naseljenih sela iz Srbije"" piše Frankfurter rundšau. Po tom dokumentu kako se navodi u medijima grad Kosovska Mitrovica dobio bi poseban status a za vodosnabdevanje ključno jezero Gazivode i rudnik Trepča bili bi privatizovani na 99 godina i podeljeni među stalnim članicama Saveta bezbednosti UN.   ]","Vučić: Zovu ljude na protest u jeku gripa, histerija prema radnicima Čistoće",2,USA,635,0.12125984251968505,5.776377952755905,12,0.5795275590551181,"['aleksandar', 'tači', 'sad', 'eu', 'trsteniku', 'pantića', 'vučić', 'trepča', 'n1', 'sinoć', 'srba', 'srbiji', 'mitrovica', 'srbije', 'drenovi', 'kosovska', 'đilasa', 'kosova', 'tanjug', 'velikoj', 'saveta', 'milo', 'beogradu', 'kruševcu', 'kosovom', 'nemački', 'kosovu', 'u', 'vašingtonu', 'un', 'bezbednosti', 'milojka', 'trifunovića']",0.0022123893805309734
166,166,7849,Svet,2019-02-23,N1-USA,"[Pristalice pokreta ""Žuti prsluci"" ponovo su demonstrirali širom Francuske petnaesti uzastopni put a na ulice je izašlo više ljudi nego prethodnog vikenda. Prema navodima ministarstva unutrašnjih poslova protestovalo je 46.600 ljudi u Francuskoj od kojih 5.800 u Parizu u odnosu na 41.000 odnosno 5.000 prošle subote. Podatke policije osporavaju ""Žuti prsluci"" i negiraju da pokret protiv politike Emanuela Makrona postepeno gubi na snazi poslednjih mesec dana. Kada su počeli demonstracije 17. novembra na ulicama ih je bilo 282.000. Većina demonstracija su prošle mirno ali bilo je sukoba u nekim gradovima kada su se razilazili demonstranti kao takoreći svakog vikenda. U Tuluzu na jugozapadu policiju su demonstranti gađali molotovljevim koktelima prema navodima policije. Krajem dana policijski izvori su naveli da je bilo privedenih u brojnih gradovima uključujući 28 u Parizu. ""Uvek nasilje izgredi počinjeni na margini okupljanja u Klermon Feranu Ruanu Monpeljeu su nepodnošljivi"" napisao je na Tviteru ministar unutrašnjih poslova Kristof Kastaner. On je pozdravio ophođenje bezbednosnih snaga koji su prema njemu delovali hladnokrvno i odlučno iako su nasilno napadani. Već nekoliko nedelja demostranti sa svoje strane osuđuju policijsko nasilje. Tokom više od tri meseca pokreta vlasti su prihvatile mere za poboljšanje kupovne moći koje ih prema proceni koštaju više od deset milijardi evra i pokrenule veliku nacionalnu debatu širom zemlje tokom koje nezadovoljni mogu da iznesu razloge svog besa.  ]","""Žuti prsluci"" ne odustaju, na ulicama širom Francuske oko 46.000 ljudi",2,USA,221,0.16289592760180996,6.846153846153847,11,0.7420814479638009,"['žuti', 'francuskoj', 'tuluzu', 'ruanu', 'monpeljeu', 'makrona', 'kastaner', 'feranu', 'klermon', 'parizu', 'kristof', 'francuske', 'emanuela', 'nepodnošljivi']",-0.006024096385542169
167,167,9119,,2018-11-16 18:58:23,RFE-USA,"Nezavisno udruženje novinara Srbije (NUNS) i Nezavisno društvo novinara Vojvodine (NDNV) saopštili su danas da su ""zgroženi"" postupkom Happy televizije koja je danas direktno u jutarnji program uključila bivšeg generala Ratka Mladića prvostepeno osuđenog na doživotnu robiju zbog genocida i drugih zločina protiv čovječnosti. NUNS i NDNV su naveli u saopštenju da nisu iznenađeni postupkom ""opasno tabloidnog TV Happy - reč je o produženoj ruci aktuelnog režima koja blagonaklono gleda na sve zločince iz mračnih devedesetih godina 20. veka"". ""Odavno se već ova TV kuća koja poseduje nacionalnu frekvenciju ponaša u skladu sa čuvenom komandom Ratka Mladića - 'Raspameti!' geslom pod kojim je gotovo četiri godine držao u opsadi glavni grad BiH Sarajevo što je bila jedna od najjezivijih opsada jednog grada u istoriji civilizacije"" naveli su NUNS i NDNV u saopštenju. Dodali su da pošto smatraju da je ;""bespredmetno"" predlagati Regulatornom telo za elektronske medije da reaguje i oduzme nacionalnu frekvenciju TV Happy od zvaničnika Srbije traže da osude ovaj slučaj a od premijerke Ane Brnabić da ispuni ono što je izgovorila u intervju za Dojče vele i da ""na delu pokaže da je protiv ratnih zločina i zločinaca"".",NUNS i NDNV: Tražimo da vlasti Srbije da osude gostovanje Mladića,11,USA,190,0.14210526315789473,6.4,11,0.7052631578947368,"['ratnih', 'brnabić', 'mladića', 'srbije', 'vele', 'bih', 'ane', 'ratka', 'nuns', 'novinara', 'sarajevo', 'dojče', 'vojvodine']",0.0064516129032258064
168,168,3164,Kultura,2018-12-16 14:31:00,Sputnik-RU,Ministarstvo kulture i informisanja Srbije odbacilo je danas ocenu crnogorskog Ministarstva kulture da su organizatori nastupa guslara na otvaranju srpskog Kulturnog centra u Pekingu „posegnuli u konkretno kulturno nasleđe Crne Gore“.</p>  Ministarstvo kulture i informisanja takođe napominje da je Srbija prilikom nominacije pevanja uz gusle za Uneskovu listu nematerijalne kulturne baštine podnela opsežnu dokumentaciju.„Tokom dvogodišnje procedure stručnjaci Uneska su vrednovali priloženi dosije i čitava procedura je bila javna. Upis na listu Uneska ne znači da tvrdimo da su Srbi izmislili gusle i guslanje nego da je reč o temeljnoj i živoj baštini srpskog naroda o čemu svedoče brojna udruženja i posećene guslarske večeri“ ukazuje se u saopštenju.U tom ministarstvu takođe ocenjuju da je Ministarstvo kulture Crne Gore „sa više takta i skrupula trebalo da se oglasi u vezi sa ovom temom“.„Obaveštavamo ih da Srbija nije ’posegnula‘ ni u čije kulturno nasleđe ’predstavljajući ga kao svoje‘ i ohrabrujemo ih da pažljivije izuče nesporne etnografske i etnomuzikološke činjenice pre nego što posegnu za neprimerenom i neargumentovanom jetkošću. Ministarstvo kulture i informisanja Republike Srbije i naše ustanove kulture spremni su da im u tom poslu pruže i odgovarajuću pomoć i podatke“ dodaje se u saopštenju.,Slučaj „Gusle“: Srpsko ministarstvo kulture uputilo oštru poruku Crnoj Gori,12,RU,192,0.140625,6.864583333333332,10,0.671875,"['centra', 'pekingu', 'gore', 'srbije', 'kulturnog', 'crnoj', 'crne', 'republike', 'jetkošću', 'srbija']",0.006711409395973154
169,169,3409,Politika,2018-12-29 11:31:00,Sputnik-RU,Predsednik Srbije Aleksandar Vučić otvorio je danas novu Hiruršku bolnicu u Vranju uz poruku da će Srbija nastaviti da napreduje i da je niko i ništa neće baciti na kolena uprkos napadima i pritiscima sa svih strana posebno iz regiona uključujući mere Prištine.Vučić je poručio da će Srbija sačuvati mir ali i da je niko neće baciti na kolena.Kako je rekao poslednjih nedelja nasrnuli su na naš narod na Kosovu i Metohiji i na Srbiju u celini jer Priština radi stvari koje civilizovani ljudi ne rade a napadaju nas i sa različitih strana iz regiona.„Dok se neki veliki prave da ne vide i ne čuju već ćute svima koji misle da je Srbija jednako neodgovorna i neozbiljna kao nekada ili slaba da izdrži sve pritiske i da će Srbiju baciti na kolena — kažem vam da ćemo da čuvamo mir ali da nas na kolena niko neće baciti niti pokoriti. Srbija će ići napred“ poručio je predsednik.Vučić je rekao da je i zdravstveni centar u Vranju deo napretka zemlje i da će od ponedeljka građani moći da vidite šta je sve urađeno.„Da osetite novu nadu i da Vranje ima budućnosti i da možete da dobijete najbolje usluge kao što se dobijaju u Beogradu Nišu Novom Sadu i drugi velikim gradovima.“Vučić kaže da su izgrađene nove prostorije i nabavljeni najbolji uređaji i da će i po tome građani Vranja moći da vide koliko se toga u Srbiji promenilo nabolje.,"Vučić: Nasrnuli su na Srbiju u celini, neće nas baciti na kolena",12,RU,238,0.18067226890756305,5.605042016806721,12,0.6050420168067226,"['aleksandar', 'novom', 'nišu', 'sadu', 'vučić', 'vranja', 'vranje', 'vranju', 'kolena.kako', 'srbiju', 'predsednik.vučić', 'srbiji', 'kosovu', 'beogradu', 'priština', 'metohiji', 'srbija']",0.04137931034482759
170,170,440,Bezbednost,2018-11-25,Vostok-RU,Nakon što su tri ukrajinska vojna broda danas ušla u teritorijalne vode Rusije krenula je potera za njima. Na snimku se vidi udar ruskog vojnog broda u jednog od njih u Kerčskom moreuzu . Rusija je potom blokirala moreuz te poslala avijaciju da patrolira područjem. Više o današnjim incidentima na Više o današnjim incidentima na Više o današnjim incidentima na Više o današnjim incidentima na Ukrajina i Novorusija iz minuta u minut ,Momenat udara ruskog u ukrajinski vojni brod danas u Kerčskom moreuzu,11,RU,72,0.2222222222222222,6.027777777777778,11,0.7083333333333334,"['ukrajinski', 'rusije', 'kerčskom', 'ukrajina', 'rusija']",0.0
171,171,1197,Kultura,2019-01-02,Vostok-RU,Ovaj film pokušaće da razbije loše predrasude i neznanje o srpsko-ruskim odnosima i o pitanju koje sve češće čujemoA KADA SU NAM TO RUSI POMOGLI?“.Rad na filmu blagoslovio je Episkop niški g. Arsenije.Film je urađen u sklopu međunarodnog rusko-srpskog prosvetnog projekta potpisanog izmeđuOŠ Bubanjski heroji” iz Niša i ruske škole br.11 iz grada Šuja Ruska federacija.OŠ Bubanjski heroji” je već duži niz godina u međunarodnoj saradnji sa ruskim školama.Ovaj film ima jedanest fagmenta. Režija tekst i kameraĐorđe Bojanić montaža animacija i scenografijađakon Dejan Jovanović.Film prate mnoštvo fotografija video zapisa animacija istorijske karte. U filmu osim delova koji su prirediliučenici OŠ Bubanjski heroji“(osmi razred) i učeniciosnovne škole br.11 (deveti razred) iz grada Šuja (Ruska federacija) čućemo i studenta Bogoslovije u BeograduLuku Milenkovića.Učesnik filma je i komadant Kopnene vojskegeneral Milosav Simović a deo filma je snimljen i uRusko-srpskom humanitarnom centru gde smo razgovarali sa kodirektorom Vjačeslavom Vlasenkom.Obratio se i predsednik srpskog ogranka ruskog moto-kluba Noćni vukovi”Saša Savić.U filmu govori i zamenik gradonačelnika Nišadr Miloš Banđur. Videćemo i obraćanjeduhovnika oca Raše.Film je završen na praznik Materice snimanjem u manastiru Sveti roman sa duhovnikomocem Vlajkom Grabežom.Iz Moskve obratio se i Kozak iz Kislovodska  sa KavkazaOleg Fomčenko Brovkov zamenika atamana kozačke opštineSvetog Carevića Alekseja“ i diplomata. Kozak Oleg je u par navrata obiša Srbiju i snimio film o Srbiji za ruse.Na kraju filma se obraća i prof. istorijeĐorđe Bojanić.Nadamo se da će ovaj film mnogima da razjasni događaje koji su isprepletani obostranom ljubavlju i pomoći kroz istoriju ova dva bratska naroda.Dobro je da konačno imamo film ovog obima i ove sadržine koji obuhvata celokupnu temu srpsko-ruskih odnosa i obostrane bratske pomoći. Film je urađen bez ikakvih finansijskih sredstava biće dostupan svima koji žele da ga emituju bez finansijske nadoknade naglašava Đorđe Bojanić. ,"Uskoro dokumentarni film ,,Ruska pomoć Srbiji kroz istoriju“",1,RU,287,0.10801393728222997,7.083623693379791,8,0.7421602787456446,"['milosav', 'federacija.oš', 'ruskog', 'raše.film', 'dejan', 'miloš', 'alekseja', 'kavkaza', 'savić.u', 'arsenije.film', 'nišadr', 'đorđe', 'sveti', 'bojanić', 'srbiji', 'izmeđuoš', 'kozak', 'simović', 'grabežom.iz', 'episkop', 'šuja', 'oleg', 'niša', 'fomčenko', 'niški', 'banđur', 'vlajkom', 'carevića', 'brovkov']",0.0036101083032490976
