,Unnamed: 0,Unnamed: 0.1,category,date,source,text,title,month,country-source,article_len,ratio_not_stop_w,avg_word_len,title_len,ratio_unique_words,ner,sen
83,83,9758,,2018-12-27 18:51:58,RFE-USA,Saudisjki kralj Salman imenovao je dugogorišnjeg ministra finansija Ibrahima el-Asafa za šefa diplomatije umesto Adela el-Džubeira u nastojanju da popravi imidž kraljevstva nakon krize izazvane ubistvom novinara Džamala Kašogija i ratom u Jemenu. Zvanični Rijad na udaru međunarodne kritike zbog ubistva Kašogija u saudijskom konzulatu u Istanbulu u oktobru. Takođe sve je više sumnji u opravdanost saudijske intervencije u Jemenu jer su milioni ljudi suočeni sa glađu i drugim nevoljama zbog ratnih dejstava. Međunarodna koalicija predvođena Rijadom bori se protiv pokreta Huti koji kontroliše glavni grad Jemena. Oba ova događaja prilično su narušili reputaciji Salmanovog sina i naslednika Mohamada (33) koji be trebalo da zauzme tron što bi bio prvi transfer vlasti sa oca na sina posle više od 65 godina u Saudijskoj Arabiji. Stručnjaci za saudijsku politiku smatraju da je zamena ministra inostranih poslova učinjena zbog uverenje da je ugled dosadašnjeg Džuberia iako veterana u diplomatiji narušen zbog uloge glavnog branioca Rijada tokom slučaja Kašogi. “Asaf će u osnovi slediti naređenja ali se doživljava kao ključna ličnost u obnovi poljuljanog imidža imajući u vidu da uživa respekt u međunarodnoj javnosti. Dakle to zvuči novo u Novoj godini ali bez suštineske promene” kazao je za Rojters Nejl Kiliam ekspert londonskog Četem hausa. Asaf je bio među desetinama biznismena zvaničnika i članova kraljevske kuće pritvorenih u luksuznom hotelu prošle godine tokom antikorupcijeske kampanje koju je naložio prestolonaslednik Mohamad ali je brzo pušten na slobodu. Promene u vladi koje su izvršene u još nekoliko ministarstava sprovedene su jer ističe četvorogodišnji mandat kabineta saopštava zvanični Rijad.    ,Ministar finansija novi šef saudijske diplomatije,12,USA,253,0.15810276679841898,6.810276679841897,6,0.7905138339920948,"['hausa', 'istanbulu', 'četem', 'jemena', 'ibrahima', 'džamala', 'saudisjki', 'oktobru', 'saudijskoj', 'arabiji', 'kašogija', '-', 'salman', 'mohamad', 'asaf', 'el', 'jemenu', 'mohamada']",0.035175879396984924
84,84,3161,Politika,2018-12-16 07:55:00,Sputnik-RU,Politička analitičarka iz SAD Pamela Geler kaže da je Kosovo „država džihadista u srcu Evrope“ i da je njen savet američkoj administraciji povodom kosovskog čvora da obavezno podrži Srbiju.„To je stav koji imam godinama od vremena kada je predsednik Bil Klinton napravio jednu od mnogih katastrofalnih grešaka podržavajući muslimansku stranu tokom građanskog rata u Bosni“ navodi Gelerova za „Novosti“.Na pitanje kako vidi neuspeh samoproglašene države Kosovo u Interpoliu ona ističe da se u organizacijama kao što je Interpol realna situacija stavlja ispred političke korektnosti.„Članice Interpola su priznale čak iako je to prećutno da je Kosovo puno džihadista i islamskih teroritsa koji se mogu infiltritari u prištinske institucije. To nije nužno za promenu u stavu međunarodne zajednice. Još ne postoji opšte priznanje na nivou EU i UN o tome šta je Kosovo i zašto je ono značajno za Evropu. Meni je jasno da je Kosovo džihadistička država u srcu Evrope“ kaže Gelerova.Upitana da li bi Trampova administracija podržala nacionalne interese Srbije u BiH i na Kosovu ona kaže:„Da imate prijatelje u američkoj administraciji. Svakako savetnik predsednika Džon Bolton ima objektivniji stav i ima više razumevanja za situaciju na Balkanu nego mnogi drugi spoljnopolitčki stručnjaci“.Ona navodi da se Bolton godinama suprotstavljao stvaranju nezavisnog Kosova a smatra da „i Bolton i Tramp imaju zasluge za promenu spoljne politike prema Kosovu“.Povodom presuda Haškog tribunala koji je za ratne zločine osudio na desetine Srba a veoma mali broj Bošnjaka i Hrvata ocenjuje da je „tzv. međunarodna zajednica za ljudska prava duboko korumpirana i pristrasna kada su u pitanju nemuslimani“. List piše da je Gelerova američki aktivista novinar i politički komentator a u javnosti je poznata i po snažnim vezama sa najvišim funkcionerima Trampove administracije uključujući i savetnika za nacionalnu bezbednost Džona Boltona kao i da je trenutno predsednica nevladine organizacije „Zaustavimo islamizaciju Amerike“.,Kosovo je država džihadista u srcu Evrope,12,RU,298,0.16778523489932887,6.744966442953019,7,0.7080536912751678,"['kosovo', 'evrope', 'bil', 'administraciji', 'nacionalne', 'interpoliu', 'boltona', 'klinton', 'eu', 'bih', 'samoproglašene', 'srbiju', 'evropu', 'džon', 'list', 'srbije', 'amerike', 'kosova', 'bolton', 'novosti', 'kosovu', 'interpola', 'haškog', 'džona', 'bosni', 'un', 'pamela', 'geler', 'hrvata', 'tramp']",0.013953488372093023
85,85,8383,Aktuelno,2018-11-26 22:56:17,VOA-USA,Američki državni sekretar Majk Pompeo pozvao je vlasti na Kosovu da povuku tarife koje su uvele na robu iz Srbije i BiH i da “rade sa Srbijom kako bi se izbegle provokacije i spustile tenzije” navodi se u saopštenju Stejt departmenta izdatom posle sastanka američkog državnog sekretara sa kosovskim predsednikom Hašimom Tačijem u Vašingtonu. “Normaliazacija odnosa između Srbije i Kosova je jedini put za integraciju obe zemlje u zajednicu zapadnih zemalja. SAD su spremne da pomognu i podrže obe strane da postignu rešenje koje je trajno primenjivo i koje povećava stabilnost” navodi se u saopštenju. Državni sekretar SAD je ohrabrio Kosovo da ne propusti priliku za “postizanje istorijskog dogovora o normalizaciji sa Srbijom pod okriljem EU”. Iz Stejt departmenta je saopšteno da je sekretar Pompeo potvrdio snažnu podršku SAD nezavisnom Kosovu potpuno integrisanom u međunarodnu zajednicu. Pompeo je čestitao Tačiju i građanima Kosova na “velikom napretku koji su postigli u deceniji od proglašenja nezavisnosti” i razgovarao o važnosti unapređivanja vladavine prava i ekonomskog razvoja kako bi se osigurala uspešna budućnost Kosova. Predsednik Kosova Hašim Tači je posle sastanka za albanski servis Glasa Amerike izjavio da je sa američkim državnim sekretarom imao odličan sastanak i da su “SAD su još jednom potvrdile svoju podršku postizanju mirnog konačnog i trajnog rešenja između Kosova i Srbije uz mogućnost međusobnog priznanja; zamenu rezolucije 1244 i članstvo Kosova u UN”. Pompeo je kaže Tači snažno podržao dijalog i pregovore Srbije i Kosova i postizanje dogovora u što kraćem roku. “Da Srbija i Kosovo nemaju probleme ne bi bilo potrebe za pregovorima. Obe zemlje su nezavisne suverene i autonomne u donošenju odluka. Naš region je na raskrsnici i neophodno je da Srbija i Kosovo postignu konačni dogovor kako bi Kosovo jednom zauvek rešilo problem sa Srbijom i fokusiralo na ekonomski razvoj” rekao je Tači za albanski servis Glasa Amerike.      ,Pompeo pozvao Kosovo da ukine tarife na robu iz Srbije,11,USA,303,0.1122112211221122,6.491749174917492,10,0.6072607260726073,"['stejt', 'kosovo', 'fokusiralo', 'tačijem', 'srbija', 'tači', 'sad', 'eu', 'bih', 'departmenta', 'kosovskim', 'hašim', 'albanski', 'srbijom', 'srbije', 'amerike', 'kosova', 'majk', 'kosovu', 'vašingtonu', 'un', 'hašimom', 'američkog', 'pompeo']",0.009174311926605505
86,86,3387,Kultura,2018-12-28 09:35:00,Sputnik-RU,„Ocenio bih razvoj kulturnog života u Srbiji visokom ocenom. Pored dva kapitalna projekta – otvaranja Narodnog muzeja ponovo rekonstruisanog posle nedopustivo duge pauze i otvaranja kulturnog centra ’Ivo Andrić‘ u Pekingu desile su se još mnoge stvari“.Kraj godine je uvek vreme za sumiranje utisaka. Ministra kulture i informisanja pri vladi Republike Srbije Vladana Vukosavljevića pitali smo kako ocenjuje 2018 ali i koji su planovi u oblasti kulture za 2019. godinu.  Ministar je izrazio posebno zadovoljstvo što je njegov sektor konstatovao da u Srbiji postoji veliki broj poslanika kulture. Prema njegovim rečima srpski kulturni život počiva na velikom broju posvećenih stručnih vrednih i pametnih ljudi. „Ja im i ovom prilikom odajem priznanje – da nema njih Ministarstvo samo ne bi moglo da uradi ništa. Ono je tu samo kao pomoć podsticaj neki izvor finansiranja. U svakom slučaju kulturni život u Srbiji je zaista u 2018. godini bio u datim okolnostima kvalitetan. Mi ćemo nastaviti da unapređujemo kulturni ambijent i finansijski i stručno i organizaciono na različite načine. Davaćemo podsticaj podršku svima onima koji su nosioci tog kulturnog života.“Naš sagovornik takođe za sledeću godinu najavljuje velike planove.„Nameravamo da Srbija otvori kulturni centar u Moskvi i u Londonu 2020. će to biti u Berlinu. Planiramo završetak radova na rekonstrukciji pozorišta u Vranju rekonstrukciju velike sale ’Šumadija‘ u Kragujevcu koja će da pruži novi zamah kulturnom životu jednog važnog srpskog grada sa dosta prostora da se u kulturnom smislu investiciono i na druge načine razvija“ naglasio je Vukosavljević i dodao da je u planu rekonstrukcija pozorišta u Nišu početak izgradnje male scene u postojećoj zgradi narodnog pozorišta u tom gradu i nastavak radova na okončanju izgradnje narodnog pozorišta u Subotici.Ipak ministar je skrenuo pažnju i na loše tendencije kada je u pitanju kultura i izrazio želju da se određene stvari promene u narednoj godini.  Na pitanje šta bi poželeo slušaocima i čitaocima Sputnjika u 2019 ministar kaže:„Dobro zdravlje svaku vrstu lične sreće i zadovoljstva snage da se nose sa izazovima svakodnevnog života. I više vremena da slušaju kvalitetne sadržaje i čitaju ih sa Sputnjika!“,"Vukosavljević: Srpski centar u Moskvi 2019, pratite Sputnjik i u narednoj godini! (video)",12,RU,340,0.13823529411764707,6.552941176470588,13,0.7088235294117647,"['pekingu', 'andrić', 'srbije', 'sagovornik', 'londonu', 'vladi', 'vukosavljević', 'vranju', 'kragujevcu', 'narodnog', 'muzeja', 'ivo', 'republike', 'moskvi', 'vukosavljevića', 'šumadija', 'berlinu', 'srbiji', 'nišu', 'vladana']",0.025830258302583026
87,87,7866,Region,2019-02-23,N1-USA,"[Davor Dragičević otac mladića čija je nerazjašnjena smrt u martu 2018. postala povod za masovne proteste u Republici Srpskoj najavio je da će uskoro objaviti video snimak ubistva sina Davida na kome se navodno vide i počinioci i odbacio je tvrdnje policije da je on sam naručio izradu takvog montiranog video zapisa. ""Uskoro ću objaviti snimak ubistva mog sina Davida Dragičevića a tada će nastati pravi haos u BiH"" rekao je za portal Srpskainfo Davor Dragičević. Objasnio je da su video zapis ubistva koje se dogodilo u centru grada zabeležile kamere na Rajfajzen banci. ""Na snimku se sve detaljno vidi između ostalog i to ko ga je ubio. Zbog toga vlada velika panika i u policiji ali i u banjalučkom državnom tužilaštvu"" rekao je Dragičević. Pri tome je odbacio tvrdnje policije i dela medija da je on nudio 15.000 evra za montirani snimak tog ubistva. ""Imao sam informaciju da to istražuju ali svi znaju da to nije točno"" dodao je. Dragičević koji je napustio BiH iz bezbednosnih razloga rekao je i da ima problema s ekshumacijom posmrtnih ostataka sina Davida. Sa suprugom je ranije podneo zahtev da se mladićevo telo sahrani van BiH no sada kako tvrdi vlasti traže dodatne potvrde i ovlašćenja. ""Traže da to dostavimo u roku od sedam dana ili će nam biti odbijena mogućnost da ekshumiramo telo. Ako mi ne odobre lično ću ga iskopati i izneti iz države"" rekao je Davor Dragičević. Ubistvo mladića Davida Dragičevića podstaklo je masovne proteste protiv vlasti u Republici Srpskoj a u njih su se uključili i lideri opozicije. Njegov otac Davor Dragičević nestao je 30. decembra kada je policija silom rasterala demonstrante grupe ""Pravda za Davida"" i pojavio se početkom februara u programu N1 te poručio kako nije pobegao nego se sklonio kako ne bi bio ubijen. Tvrdi da njegovu likvidaciju želi politički i policijski vrh u Republici Srpskoj.  ]",Davor Dragičević tvrdi da ima video snimak ubistva sina Davida,2,USA,311,0.15434083601286175,5.948553054662379,10,0.6527331189710611,"['dragičevića', 'martu', 'bih', 'republici', 'državnom', 'srpskoj', 'dragičević', 'banjalučkom', 'davida', 'davor', 'tužilaštvu', 'pravda']",-0.013513513513513514
88,88,6472,Svet,2019-01-24,N1-USA,"[Visoki komesarijat UN za izbeglice (UNHCR) izrazio je žaljenje zbog političkog govora u Evropi koji je ""potpuno nesrazmeran sa stvarnošću"" migrantskog pitanja čime se ""podstiče strah"". Broj zahteva za azil u Evropi ""zaista je smanjen poslednje dve godine"" i sada je u proseku kao početkom 2000-ih izjavio je zvaničnik UNHCR-a Folker Tirk novinarima u Parizu. Tirk je rekao da je istovremeno u Evropi politički govor potpuno nesrazmeran sa stvarnosću čime se ostavlja ustisak da su mase ljudi na putu. Zvaničnik UNHCR-a je izrazio žaljenje zbog takvih govora koji stvaraju osećaj straha a to ne pomaže racionalnom sagledavanju stvarnosti. Tirk je rekao da je Globalni sporazum o bezbednim uređenim i regularnim migracijama koji je usvojen u Marakešu izazvao burne reakcije navodeći primer u Francuskoj gde su protivnici teksta igrali na kartu straha dok je sporazum neobavezujućeg karakatera.  ]",UNHCR: Politički govor u Evropi nesrazmeran sa stvarnošću migrantskog pitanja,1,USA,137,0.1678832116788321,6.532846715328468,10,0.6934306569343066,"['evropi', 'francuskoj', 'tirk', 'karakatera', 'un', 'neobavezujućeg', 'parizu', 'unhcr', 'izbeglice']",-0.02830188679245283
89,89,6435,Vesti,2019-01-23,N1-USA,"[Predsednica Skupštine Srbije i članica Predsedništva Srpske napredne stranke (SNS) Maja Gojković izjavila je da SNS razmišlja o prevremenim parlamentarnim izborima i da ih većina naprednjaka želi ali da će se o tome odlučivati na osnovu mnogih okolnosti. ""Videćemo. Imaćemo i Predsedništvo nakon toga Glavni odbor SNS. Mnogo okolnosti će odlučivati o tome u korist Srbije a ne u korist jedne političke partije"" rekla je Gojković za televiziju Pink. Ona je rekla da SNS ima veliko poverenje građana Srbije ali da se naprednjacima stalno spočitava i govori da su ""oteli vlast i sprovode nekakvu hajdučiju u državi"". ""Najbolje je izaći pred građane Srbije i videti šta misle o nama a šta misle o (Draganu) Đilasu (Vuku) Jeremiću Mariniki Tepić o devojci koja izmišlja da se ne bavi politikom"" rekla je Gojković. Ona je rekla i da Savez za Srbiju promoviše opasne društvene vrednosti i model ponašanja i da žene SNS koje su bile izložene uvredama ""poput onih koje sada novinarkama upućuje glumac Sergej Trifunović"" više neće da ćute.  ]",Gojković: Većina naprednjaka želi izbore,1,USA,169,0.16568047337278108,6.11242603550296,5,0.6863905325443787,"['sns', 'srbije', 'trifunović', 'stranke', 'maja', 'skupštine', 'tepić', 'vuku', 'gojković', 'odbor', 'pink', 'mariniki', 'sergej', 'draganu', 'srpske', 'đilasu', 'napredne']",0.0625
90,90,1978,Region,2019-02-13,Vostok-RU,"Predsjednik Atlas grupe Duško Knežević obratio se građanima Crne Gore otvorenim pismom u kojem je naveo da nije “ni mesija ni oslobodilac niti politički vođa” te da je njegovo da podsjeti “da nije normalno da jedan kontroliše narod a ne narod njega i da nije zdravo da zakon nije iznad svih nego da jedan iznad svega” prenosi  Borba. Pismo Kneževića:""Poslednjih mjeseci o meni ste čuli mnogo toga. Od toga za šta me optužuju traže i izmišljaju do toga da umjesto Ridžens ulicom prolazim Crvenim trgom. Sve može ljudski um da izmisli pogotovo da slaže u muci da zaboravi sve što je bilo i kako je bilo samo da bi sačuvao sebe svoje privilegije i utolio halapljivu želju za moću. Sve to rade u našoj i njihovoj zemlji njih nekolicina koji su umislili da je Crna Gora samo njihova privatni posjed Prvoga i njegove familije.  Na tom njihovom posjedu oni sebi daju za pravo sve pa i to da organizuju hajke i političke progone svojih protivnika i neistomišljnike da u taj progon uključe svoje medije servirajući laži i poluitine ali i da mafiju pozovu u pomoć da me vreba na ulicama Londona.  Dugo sam živio u zabludi da tako možda mora. Crna Gora je oduvijek voljela gospodare da im služi i kliče sve dok je ne napuste i ostave same sve svoje podanike od kojih su skrivali tajne imovinu bogastvo i planove. I danas je tako. Pokazalo se da se ništa nije promijenilo ni sa “demokratskim gospodarom” Crne Gore o čijim tajnama dvostrukom životu i skrivenom bogatstvu ovih dana svjedočim. Ne bez rizika po moju sigurnost ali bez straha. Ne smeta mi što mi je život ugrožen i što sada živim pod posebnim uslovima jer je došlo vrijeme da se sazna puna istina o svemu. Posebno o njemu.  Zašto sam u sve ovo krenuo? Neko kaže iz straha jer su nam oduzeli sve a onda sam i ja došao na red. Ne jer su u današnjoj Crnoj Gori sigurniji su oni koji ćute nego oni koji govore. Jednostavno je odlučio sam da se suprotstavim. Hoću da se oduprem besprizornom političkom progonu koji je pokrenut da bi mi lakše oteli ono što sam stvarao 30 godina. Borim se jer sam iako sam dugo boravio u inostranstvu svo znanje međunarodne kontakte i kapaciete uložio u Crnu Goru.  Odbio sam njihove ponude da pregovaramo. Ja nijesam bez odgovornosti jer sam bio u njihovom društvu. Baš kao i oni u mom iako bi to oni sada najrađe izbrisali. Zato sam odlučio da me istina vodi i da je podijelim sa Vama. Ne izmišljena i sebična istina već jedina prava dokumentovana istina. Istina koja oslobađa od straha i zavisnosti sve nas i zarobljenu Crnu Goru od jedne familije i njene svemoći. Crnoj Gori je potrebno da njome upravljaju zakoni a ne samovolja pojedinaca i njegovi poslušnici.  Sve što sam iznio i što ću tek saopštiti je puna i dokaziva istina. Njome ne želim da vam se dopadnem ili da mi aplaudirate. Želim da čujete ono što ste već naslućivali i da vidite ono što ste vjerovatno pretpostavljali.  Njima su svi krivi osim njih koji imaju sve. To što posjeduje prva familija u Crnoj Gori nema niko ni približno. Nijedan premijer ili predsjednik ni u jednoj zemlji bogate EU. Ali to ima predsjednik u siromašnoj Crnoj Gori koji iza leđa svojih građana i daleko od zakona gomila bogatstvo. Znaće se za svu njegovu imovinu pa i onu koju za njegov račun drže prolazni “investitori” iz raznih krajeva svijeta.  Pod njihovom kontrolom su i turistički rizorti ogromni zemljišni posjedi na primorju rudnici hidrocentrale banke zavodi za planiranje prostora… Njemu su odgovorni i mnoge sudije i tužilac za specijalne potrebe tajna društva agencije advokatske kancelarije za sve strane investicije privatizacije provizije za Telekom I A2A pa i klanovi koji operišu s druge strane zakona. Sve je njihovo. I naša sudbina i naše pravo na istinu naše pravo da slobodno živimo. Sve je bilo i ostalo tako.  Zato ih danas plaši glas onoga koji je bio svjedok svemu što žele da sakriju od vaših očiju. Da bi je zamaskirali počeli su da žrtvuju ljude koji su im bili odani vojnici. Neće da se zna da su uzimali donacije za sebe putovali po najskupljim svjetskim destinacijama odmarali se u kraljevskim apartmanima i to od mojih para. Nijesu htjeli da znate da sam baš njemu zahvaljujući svom znanju pomagao da dođe do prvih miliona koje je on već imao u sivoj zoni.  Da li sam ja bio prijatelj ili neprijatelj Prvoga koji sada kaže da nijesam bio dostojan njegovog prijateljstva? Kako god valjale su mu moje kartice moj novac moja finansijska podrška moja kuća za zabave i veselja. Istina je da se razlikujemo jer moj sin ne ide u Las Vegas da kocka. Svakome se samo kaže i svako vidi ko govori istinu a ko je skriva izvrće i hoće da je zaključa.  Nijesam ni mesija ni oslobodilac niti politički vođa. Moje je da podsjetim da nije normalno da jedan kontroliše narod a ne narod njega i da nije zdravo da zakon nije iznad svih nego da jedan iznad svega. Bolesno je da jedan ima više nego svi zajedno.  Takva države je zarobljena. Ona traži slobodu koja je u vašim rukama. Traži da umjesto nametnute monahrije jedne porodice Crna Gora uistinu bude demokratska država koja je članica NATO i buduća članica EU porodice da se afirmišu stvarne vrijednosti modernih društava da svako u njoj bude jednak u pravima i ravnopravan pred zakonima. Za takvu Crnu Goru se ima smisla boriti. Čak i više to je naše pravo i dužnost."" ",Knežević: Omogućio sam Milu da legalizuje prvi milion koji je zaradio u sivoj zoni,2,RU,927,0.10032362459546926,5.677454153182309,14,0.5501618122977346,"['londona', 'a2a', 'kneževića', 'las', 'eu', 'gore', 'knežević', 'gora', 'zoni', 'crne', 'crnu', 'gori', 'inostranstvu', 'telekom', 'goru', 'atlas', 'istina', 'milu', 'crna', 'vegas', 'crnoj', 'duško', 'nato', 'neko', 'crvenim']",-0.001607717041800643
91,91,653,Bezbednost,2018-12-04,Vostok-RU,Narodna milicija Luganske Narodne Republike zabeležila je na teritoriji pod kontrolom Kijeva u Donbasu nepoznate jedinice vojske u uniformama NATO-a saopštio je načelnik pres-službe Narodne milicije LNR Jakov Osadčij prenose RIA Novosti.„U oblasti odgovornosti 72. brigade u selu Svetlodarsko stigao je odred od 28 ljudi opremljenih u uniformu po uzoru na NATO“ precizirao je on.Osadčij je dodao dasituacija u zoni odgovornosti Narodne milicije LNR ima tendenciju zaoštravanja“.  Ranije su DNR i LNR saopštile da Oružane snage Ukrajine koncentrišu snage na kontakt-liniji za prebacivanje prema granici sa Rusijom.Pre nedelju dana Vrhovna Rada odobrila je Porošenkov ukaz o uvođenju ratnog stanja u deset regija Ukrajine na trideset dana nakon provokacije SBU u Kerčskom moreuzu kada su tri ukrajinska ratna broda prekršila državnu granicu Rusije a potom bila zadržana.    Ukrajina i Novorusija iz minuta u minut ,Lugansk: U Donbas stigle snage u uniformama NATO,12,RU,133,0.17293233082706766,6.857142857142858,8,0.8045112781954887,"['rusije', 'osadčij', 'ukrajine', 'lnr', 'donbas', 'jakov', 'kerčskom', 'on.osadčij', 'ukrajina', 'kijeva', 'luganske', 'republike', 'rada', 'narodne', 'pres', 'narodna', 'svetlodarsko', 'nato']",0.0
92,92,335,Politika,2018-11-20,Vostok-RU,SAD nameravaju da vrše finansijski pritisak na Iran i Rusiju zbog njihove podrške sirijskom predsedniku Bašaru Asadu izjavio je u utorak američki ministar finansija Stiven Mnučin.„Danas preduzimamo mere protiv složene sheme Irana i Rusije koja se koristi za jačanje Asadovog režima i stvaranje sredstava za iransku zlonamernu delatnost. SAD nameravaju da vrše finansijski pritisak na Iran Rusiju i druge zemlje koje nastoje da ojačaju autoritarnu Asadovu Vladu. Takođe nameravamo da osujetimo iranski režim u sponzorisanju terorističkih organizacija“ naveo je Mnučin. U saopštenju koje su objavili Ministarstvo finansija Stejt department i Obalska straža SAD navedeno je da postoji veliki rizik od uvođenja sankcija svima koji pomažu isporučivanje nafte Siriji. Takođe SAD su upozorile da će u sankcioni spisak uvrstiti kompanije za prevoz tereta finansijske kompanije i osiguravajuća društva vlasnike brodova menadžere i operatere. Američka Vlada će agresivno pratiti svako lice koje bude podržavalo (sirijski) režim kako bi ga unela na sankcioni spisak a to važi i za državne kompanije“ piše u saopštenju.   U utorak su SAD uvele sankcije protiv kako je navedeno u saopštenju Ministarstva finansija SADiransko-ruske mreže“ za isporučivanje nafte Siriji.  Prema navodima predstavnika američke administracije Teheran je uz pomoć ruskih kompanija slao naftu u Siriju što je sirijskoj Vladi omogućilo da dobije milione barela nafte iz Irana a Iranu da zaradi stotine miliona dolara iz Sirije za finansiranje Korpusa čuvara iranske revolucije kao iHamasa“ iHezbolaha“.  Situacija u Siriji - iz minuta u minut ,SAD: Vršićemo finansijski pritisak na Iran i Rusiju jer nastoje da ojačaju Asadov režim,11,RU,234,0.1282051282051282,6.863247863247862,14,0.7008547008547008,"['sad', 'bašaru', 'rusije', 'stejt', 'department', 'organizacija', 'siriji', 'sirije', 'asadu', 'utorak', 'teheran', 'siriju', 'mnučin', 'rusiju', 'iranu', 'iran', 'irana', 'stiven', 'iransko']",0.005102040816326529
